coarse,fine,english,indo
ENTY,sport,"What kind of sports did they play in the years 1642-1649 , the English Civil War time ?","Jenis olahraga apa yang mereka mainkan pada tahun 1642-1649, waktu Perang Saudara Inggris?"
ENTY,sport,In what Olympic Games did Nadia Comaneci become popular ?,Dalam Olimpiade apa Nadia Comaneci menjadi populer?
ENTY,sport,What sport was the first televised in the U.S. ?,Olahraga apa yang pertama kali disiarkan televisi di AS?
LOC,state,In which state are the Mark Twain National Forests ?,Di negara bagian manakah Hutan Nasional Mark Twain?
LOC,state,What state is Niagara Falls located in ?,Di negara bagian apa Air Terjun Niagara berada?
LOC,state,What state has the most Indians ?,Negara bagian mana yang memiliki jumlah penduduk India terbanyak?
ENTY,substance,What fuel do airplanes use ?,Bahan bakar apa yang digunakan pesawat terbang?
ENTY,substance,What four elements make up 90 percent of the human body ?,Apa empat elemen yang membentuk 90 persen dari tubuh manusia?
ENTY,substance,What are the most common elements in the Earth 's crust ?,Apa elemen paling umum di kerak bumi?
ENTY,substance,What is a softball made of ?,Terbuat dari apa softball?
ENTY,symbol,What is the celtic symbol for  life  ?,Apa simbol celtic untuk hidup?
ENTY,symbol,What is the chemical symbol for nitrogen ?,Apa simbol kimia untuk nitrogen?
ENTY,techmeth,What does the method called  cold fusion  create ?,Apa metode yang disebut cold fusion?
ENTY,techmeth,What is the formula to calculate pi ?,Apa rumus untuk menghitung pi?
ENTY,techmeth,What is the best way to overcome a fear ?,Apa cara terbaik untuk mengatasi rasa takut?
NUM,temp,What is the temperature for baking Peachy Oat Muffins ?,Berapa suhu untuk memanggang Peachy Oat Muffins?
ENTY,termeq,What does Final Four refer to in the sports world ?,Apa yang disebut Final Four di dunia olahraga?
ENTY,termeq,Aspartame is also called what ?,Aspartam disebut juga apa?
ENTY,termeq,What 's a male witch called ?,Apa sebutan penyihir pria?
HUM,title,What does Larry King do for a living ?,Apa yang dilakukan Larry King untuk hidup?
HUM,title,What is the oldest profession ?,Apa profesi tertua?
HUM,title,What was Eduard Shevardnadze 's job in the Soviet Union ?,Apa pekerjaan Eduard Shevardnadze di Uni Soviet?
ENTY,veh,"What was the name of the American ship sunk by a mine in Havana harbor , causing the Spanish-American war ?","Apa nama kapal Amerika yang ditenggelamkan oleh sebuah tambang di pelabuhan Havana, yang menyebabkan perang Spanyol-Amerika?"
ENTY,veh,What is the name of the second space shuttle ?,Apa nama pesawat luar angkasa kedua?
NUM,volsize,How large is the Arctic refuge to preserve unique wildlife and wilderness value on Alaska 's north coast ?,Seberapa besar perlindungan Arktik untuk melestarikan nilai satwa liar dan hutan belantara yang unik di pantai utara Alaska?
NUM,volsize,What is the size of Argentina ?,Berapa ukuran Argentina?
NUM,weight,What is the approximate weight of a teaspoon of matter in a black hole ?,Berapa kira-kira berat satu sendok teh materi dalam lubang hitam?
NUM,weight,How many pounds are there in a stone ?,Berapa kilogram yang ada di batu?
ENTY,word,What is a word whose letters can be rearranged to form a different word ?,Apa kata yang hurufnya dapat disusun ulang untuk membentuk kata yang berbeda?
ENTY,word,What 's the international radio code word for the letter F ?,Apa kata kode radio internasional untuk huruf F?
ENTY,word,What were the five opening words on Ben Casey ?,Apa lima kata pembuka pada Ben Casey?
