coarse,fine,english,indo
DESC,reason,What problems contributed to the high failure rate of Plains farmers in the 1800s ?,Masalah apa yang menyebabkan tingginya tingkat kegagalan petani Plains di tahun 1800-an?
DESC,reason,Why do some clothing labels say  Use a nonchlorine bleach  ?,Mengapa beberapa label pakaian mengatakan Gunakan pemutih nonklorin?
DESC,reason,Why does it snow ?,Mengapa salju turun?
DESC,reason,Why do rooftops give off steam after a big rainstorm ?,Mengapa atap rumah mengeluarkan uap setelah badai besar?
ENTY,religion,What Caribbean cult did Marcus Garvey originate ?,Dari sekte Karibia apa Marcus Garvey berasal?
NUM,speed,How fast does the fastest car go ?,Seberapa cepat mobil tercepat pergi?
NUM,speed,How fast must a spacecraft travel to escape Earth 's gravity ?,Seberapa cepat sebuah pesawat ruang angkasa harus melakukan perjalanan untuk menghindari gravitasi Bumi?
ENTY,sport,What was the name of the ball game played by the mayans ?,Apa nama permainan bola yang dimainkan oleh mayan?
ENTY,sport,What type of exercise burns the most calories ?,Jenis olahraga apa yang paling banyak membakar kalori?
ENTY,sport,What sport do the Cleaveland Cavaliers play ?,Olahraga apa yang dimainkan oleh Cleaveland Cavaliers?
ENTY,sport,What international sport was originally called hurley ?,Olahraga internasional apa yang awalnya disebut hurley?
LOC,state,What state has the longest Great Lakes shoreline ?,Negara bagian mana yang memiliki garis pantai Great Lakes terpanjang?
LOC,state,What state is John F. Kennedy buried in ?,Di negara bagian mana John F. Kennedy dimakamkan?
LOC,state,What U.S. state is Fort Knox in ?,Di negara bagian mana Fort Knox berada?
ENTY,substance,What are the chemicals used in glowsticks ?,Apa bahan kimia yang digunakan dalam glowsticks?
ENTY,substance,What is money made of ?,Terbuat dari apa uang itu?
ENTY,substance,What is the main ingredient of yogurt ?,Apa bahan utama yogurt?
ENTY,substance,"What element , from the Periodic Table , is a gas or a solid , but never a liquid ?","Elemen apa, dari Tabel Periodik, yang merupakan gas atau benda padat, tetapi tidak pernah berbentuk cair?"
ENTY,symbol,What are the signs of a country going into a recession ?,Apa saja tanda-tanda suatu negara akan mengalami resesi?
ENTY,symbol,What sign is the best love match for a horoscope sign ?,Tanda apa yang paling cocok untuk tanda horoskop?
ENTY,techmeth,What are some ways to help someone with Chicken Pox ?,Apa sajakah cara untuk membantu seseorang dengan Cacar Air?
ENTY,techmeth,"What are the 7 principles of learning from the Institute for Research on Learning , IRL ?","Apa saja 7 prinsip pembelajaran dari Institute for Research on Learning, IRL?"
ENTY,techmeth,What are the best ways to improve employee morale at low cost ?,Apa cara terbaik untuk meningkatkan moral karyawan dengan biaya rendah?
NUM,temp,What should the temperature be set at while baking Peachy Oat Muffins ?,Berapa suhu yang harus diatur saat memanggang Peachy Oat Muffins?
ENTY,termeq,What is a synonym for aspartame ?,Apa itu sinonim untuk aspartame?
ENTY,termeq,What does El Nino mean in spanish ?,Apa arti El Nino dalam bahasa Spanyol?
ENTY,termeq,What do the Japanese call Japan ?,Bagaimana cara orang Jepang menyebut Jepang?
HUM,title,What title did Shevardnadze have during the Soviet era ?,Gelar apa yang dimiliki Shevardnadze selama era Soviet?
HUM,title,What task does the Bouvier breed of dog perform ?,Apa tugas yang dilakukan anjing jenis Bouvier?
HUM,title,What occupation has the highest divorce rate ?,Pekerjaan apa yang memiliki tingkat perceraian tertinggi?
ENTY,veh,Which type of submarine was bought recently by South Korea ?,Jenis kapal selam apa yang dibeli baru-baru ini oleh Korea Selatan?
ENTY,veh,On which flight did Fawaz Younis commit air piracy and hostage taking ?,Di penerbangan mana Fawaz Younis melakukan pembajakan udara dan penyanderaan?
NUM,volsize,How big is the Electoral College ?,Seberapa besar Electoral College?
NUM,volsize,How big is our galaxy in diameter ?,Seberapa besar diameter galaksi kita?
NUM,weight,What does a teaspoon of matter weigh in a black hole ?,Berapa berat satu sendok teh materi di dalam lubang hitam?
NUM,weight,What is the weight of air ?,Berapa berat udara?
ENTY,word,What is the longest English word that can be formed using just the first row of letters on a typewriter ?,Apa kata bahasa Inggris terpanjang yang dapat dibentuk hanya dengan menggunakan baris pertama huruf pada mesin tik?
ENTY,word,What is the most famous German word in the English language ?,Apa kata Jerman paling terkenal dalam bahasa Inggris?
ENTY,word,"What word occurs 46 , 227 times in the Bible ?","Kata apa yang muncul 46, 227 kali dalam Alkitab?"
